Title,Contents,link
고스톱 치다 ‘코로나 날벼락’,울산 6080대 노인 4명 확진자와 화투 놀이하다 감염울산 코로나19 선별진료소울산지역 6080대 노인들이 화투놀이인 고스톱을 치다가 코로나19에 감염됐다31일 울산시에 따르면 76세 A씨92번와 64세 B씨93번 79세 C씨여성94번 84세 D씨95번가 지난 30일 코로나19 확진 판정을 받았다이들은 지난 29일 코로나19 확진 판정을 받은 88번 확진자 E씨67남성와 함께 지난 25일 C씨의 집에서 모여서 마스크를 착용하지 않은 채 고스톱을 친 것으로 확인됐다 이 자리에는 총 6명이 고스톱을 쳤고 확진된 5명 외에 나머지 1명은 현재 검사 결과를 기다리고 있다방역당국은 E씨88번로부터 코로나19가 전파된 것으로 추정하고 있다 E씨는 고스톱을 치기 전인 지난 22일 북구의 한 장례식장을 다녀왔고 또 지난 24일부터 29일 사이에 남구지역의 의원과 약국을 4차례 방문한 것으로 조사됐다울산시는 깜깜이 감염자’로 분류된 E씨의 감염경로를 조사하려고 GPS 추적 등 상세한 동선을 파악하고 있다 또 E씨와 장례식장에서 접촉한 것으로 추정되는 15명에 대한 행적도 찾고 있다한 내과 전문의는 “가족이 아닌 다른 사람들과 마스크를 쓰지 않고 실내 좁은 공간에서 함께 활동하는 것은 매우 위험하다”고 조언했다울산 박정훈 기자 jhpseoulcokr 네이버에서 서울신문 구독하기 클릭  세상에 이런 일이  연예계 뒷얘기 클릭ⓒ 서울신문wwwseoulcokr 무단전재 및 재배포금지,https://news.naver.com/main/ranking/read.nhn?mid=etc&sid1=111&rankingType=popular_day&oid=081&aid=0003120131&date=20200831&type=1&rankingSectionId=102&rankingSeq=4
박보검 입대…코로나 방역수칙 지킨 채 '조용한 안녕'(종합),팬들도 온라인 응원부대서 코로나19 검사받을 예정박보검 해군 입대 코로나19 속 마스크 쓰고 들고 창원연합뉴스 김동민 기자  배우 박보검이 31일 오후 경남 창원시 진해구 해군교육사령부에 해군병 669기로 입대하고 있다박보검은 6주간 신병 훈련을 받고 해군 문화 홍보병으로 오는 2022년 4월까지 근무할 예정이다 2020831 imageynacokr창원연합뉴스 한지은 기자  배우 박보검27이 31일 경남 창원시 진해 해군교육사령부에 입대했다사전에 예고한 대로 눈인사나 경례 없이 조용한 입소였다박보검은 이날 오후 2시께 검은 캡 모자에 상하 검은색 트레이닝복을 입고 검은색 운동화를 신은 채 훈련소로 향했다모자와 마스크를 쓴 채 고개를 푹 숙이고 있어 주변에서 신병을 안내하는 해군조차도 박보검인지 알아채지 못할 정도였다 모자 아래로 짧게 자른 머리도 눈길을 끌었다박보검은 함께 입소하는 동기들과 사회적 거리를 유치한 채 줄 맞춰 이동했다박보검은 훈련소 입구에서 안내 해군으로부터 지급받은 마스크를 유심히 바라보기도 했다 그는 줄을 서 있는 동안 손에 쥔 마스크를 360도 돌리며 손장난을 치는 모습도 보였다1천명이 넘는 신병이 입대하면서 이날 훈련소 앞은 북적였지만 해군과 경찰의 통제로 큰 혼란은 없었다일부 시민들은 가족이 이미 입소했지만 혹시나 박보검을 볼 수 있을까 하는 기대로 계속 훈련소 인근에 있기도 했다취재를 마치고 철수하는 취재진에게 박보검 들어갔어요라고 묻는 여성도 있었다박보검의 팬들은 코로나19 확산을 방지하고자 배웅을 자제해 거의 찾아볼 수 없었다팬들은 실제로 찾아가는 대신 온라인 커뮤니티 등을 통해 응원을 보냈다박보검 조용한 입대창원연합뉴스 김동민 기자  배우 박보검이 31일 오후 경남 창원시 진해구 해군교육사령부에 해군병 669기로 입대하고 있다박보검은 6주간 신병 훈련을 받고 해군 문화 홍보병으로 오는 2022년 4월까지 근무할 예정이다 2020831 imageynacokr박보검 등 이날 입대한 훈련병들은 부대 안에서 유전자 증폭PCR 검사를 거쳐 신종 코로나바이러스 감염증코로나19 감염 여부를 확인할 예정이다PCR 검사 결과는 내달 1일께 나온다음성 판정을 받아야 예정대로 기초 군사교육 훈련을 받을 수 있다박보검은 해군교육사령부 669기로 입대했다동기 1천300여명과 1주간 입영 주를 거친 뒤 5주간 군인 기본자세와 전투 기술을 배우게 된다6주간 신병 훈련이 끝나면 자대 배치를 받게 된다해군본부에서 문화 홍보병으로 복무할 예정이다제대는 2022년 4월 말이다배우 박보검 해군 입대창원연합뉴스 김동민 기자  배우 박보검이 31일 오후 경남 창원시 진해구 해군교육사령부에 해군병 669기로 입대하고 있다박보검은 6주간 신병 훈련을 받고 해군 문화 홍보병으로 오는 2022년 4월까지 근무할 예정이다 2020831 imageynacokrcontactjeynacokr코로나19 속보는 네이버 연합뉴스구독 클릭팩트체크 코로나19가 탈모 원인제보하기,https://news.naver.com/main/ranking/read.nhn?mid=etc&sid1=111&rankingType=popular_day&oid=001&aid=0011849812&date=20200831&type=1&rankingSectionId=103&rankingSeq=2
"""한달새 1억 뛰었다""…서울 집값 못잡고 세종만 띄운 천도론",세종시 어진동 밀마루 전망대에서 바라본 시내에 아파트 건설이 한창이다 최근 세종시는 전국에서 가장 아파트값이 많이 올랐다 연합뉴스“한달 사이 1억원 올랐어요 금강이 한눈에 보이는 전용 109㎡는 15억원에 나옵니다”  세종시 보람동 호려울마을 10단지 중흥S클래스 인근에서 공인중개업체를 운영하는 허모 대표의 얘기다 그는 “요즘 집값이 오르자 집주인들이 매물을 거둬들여 물건도 거의 없다”고 했다31일 국토부 실거래가 시스템에 따르면 이 단지 전용면적 109㎡가 이달 3일 15억7000만원에 거래됐다 투기과열지구인 세종시에서 처음으로 주택담보대출이 금지되는 15억 초과 아파트가 등장했다 지난해 말 매매가격11억5000만원과 비교하면 올해 들어 8개월만에 374억2000만원 오른 셈이다 8월 아파트값 상승률 전국 1위는 세종 그래픽김영희 02joongangcokr  ━주담대 0인 15억 초과 아파트 등장세종시 집값에 불을 붙인 것은 정치권에서 띄운 행정수도 이전’ 이슈다 여당은 지난달부터 국가균형발전을 위해 행정수도를 세종시로 옮길 필요가 있다고 주장했다 좁은 서울에 사람이 몰리고 경제가 집중된 상황에서 벗어나려면 국회를 비롯해 정부기관이 통째로 세종으로 이전해야 한다는 것이다 이른바 천도론’이 좀처럼 수그러들지 않는 서울의 집값 상승세도 잡아줄 것으로 기대했다  하지만 행정수도 이전 이슈는 서울 집값 상승세를 잡지 못했다 오히려 세종시 집값까지 끌어올렸다 KB부동산에 따르면 8월 세종시 주택 매매가격지수는 전달보다 64 올랐다 상승률로는 전국 1위다 같은 기간 서울 집값 상승 폭15의 4배 이상이다 세종시 아파트값은 더 올랐다 아파트 매매가격지수는 전월 대비 78 상승했고 지난해 말과 비교하면 23나 급등했다정치권이 쏘아 올린 천도론 발發 집값 급등에 피해를 보는 곳은 실수요자다 세종시에 사는 40대 주부 신모씨는 “집을 사려고 석 달 전부터 아름동 일대 아파트를 알아보는데 집값이 갑작스럽게 급등하면서 의욕이 사라진다”고 토로했다 그는 “정부가 강력한 부동산 정책을 펴고 있어 곧 집값이 안정될 줄 알았지만 최근까지 한 달도 안 돼 1억씩 오르더니 이젠 매물마저 자취를 감추고 있다”고 말했다세종 주요 아파트 매매가 그래픽김영희 02joongangcokr  ━공무원만 특공 혜택 불만의 목소리도부동산 관련 인터넷 카페 등에서는 불만의 목소리도 나온다 세종시 집값이 뛰면서 시세보다 낮게 특별공급 분양을 받은 일부 공무원이 수억원의이익을 거둘 수 있어서다 세종시는 10년 전부터 분양 아파트 물량의 절반가량을 세종시로 옮겨온 정부 부처 공무원이나 공기업 직원 등에게 배정하고 있다일부는 실제 거주하지 않다가 전매제한 5년이 풀리면 판 경우도 있다 그러다 보니 행정수도 이전설로 오히려 공무원만 혜택을 보는 게 아니냐는 시각도 있다━올해 거래량 폭발적 집값 상승세 지속부동산 전문가들은 당분간 세종시 집값 상승세는 이어질 것으로 예상했다 김연화 IBK기업은행 부동산팀장은 “617대책으로 주변 대전시와 충북 청주가 규제지역으로 신규 지정되면서 행정수도 이슈를 품은 세종시로 자금이 더 쏠리고 있다”고 말했다 그는 “다만 하반기 5000여 세대 공급 물량이 예정된 만큼 신규 단지나 조망이 좋은 아파트 중심으로 가격 차별화 현상이 나타날 수 있다”고 덧붙였다함영진 직방 빅데이터랩장은 “올해 18월까지 세종시 아파트 거래량은 계약일 기준 6492건으로 이미 지난해 전체 거래량5802건을 넘어섰다”며 “내년 아파트 입주 물량이 늘긴 하지만 대기수요가 많아서 집값 상승세는 한동안 이어질 것”으로 내다봤다염지현 기자 yjhjoongangcokr넌 뉴스를 찾아봐 난 뉴스가 찾아와 그래서 팩트가 뭐야 궁금하면 팩플 세상 쉬운 내 돈 관리 그게머니ⓒ중앙일보httpsjoongangcokr 무단 전재 및 재배포 금지,https://news.naver.com/main/ranking/read.nhn?mid=etc&sid1=111&rankingType=popular_day&oid=025&aid=0003030888&date=20200831&type=1&rankingSectionId=101&rankingSeq=1
"인도네시아 경찰, 결혼식서 마스크 안 쓴 신랑 팔굽혀펴기 지시",인도네시아 경찰이 마스크를 쓰지 않고 결혼식을 치르던 신랑에게 다가가 팔굽혀펴기를 시키고 마스크를 씌워주는 동영상이 퍼져 눈길을 끌었습니다인도네시아는 코로나19 차단을 위한 보건지침을 어길 경우 지역별로 과태료 8천 원 이슬람 경전 쿠란 암송 화장실 등 청소 팔굽혀펴기 쪼그려 뛰기 등의 벌칙을 주고 있습니다트리뷴뉴스 등에 따르면 26일 저녁 동부 자바주 파수루안군에서 열린 결혼식에서 신랑신부와 상당수 하객이 마스크를 쓰지 않았습니다인도네시아 경찰관은 결혼식 중 신랑에게 다가가 하객들 앞에서 팔굽혀펴기를 세 차례 하라고 지시했습니다머쓱한 표정의 신랑이 팔굽혀펴기를 마치자 경찰관이 신랑 얼굴에 마스크를 직접 씌워줬습니다해당 경찰관은 마스크를 쓰지 않은 신랑을 벌주기 위해서라기보다 마스크 착용의 중요성을 알리려고 팔굽혀펴기를 시켰다며 경찰은 보건지침 준수 확인을 위해 마을에서 열리는 어떤 행사든 찾아갈 것이라고 말했습니다이어 하객 수 제한 떨어져 앉기 결혼식장 입구에 손 씻기를 위한 세면대 설치 등의 지침은 잘 지켰으나 신랑신부는 물론 하객 수십 명이 마스크를 쓰지 않아 일일이 마스크를 나눠줬다고 덧붙였습니다저작권자c YTN  YTN plus 무단전재 및 재배포 금지  이 시각 코로나19 확진자 현황을 확인하세요대한민국 대표 뉴스 채널 YTN 생방송보기네이버에서 YTN 뉴스 채널 구독하기 ,https://news.naver.com/main/ranking/read.nhn?mid=etc&sid1=111&rankingType=popular_day&oid=052&aid=0001484940&date=20200831&type=2&rankingSectionId=104&rankingSeq=5
[속보] 경남서 광화문 집회 참가자 일가족·약사 등 3명 추가 확진,아시아경제 김가연 기자 경남에서 광화문 집회 참가자 일가족과 약사 등 코로나19 확진자 3명이 추가 발생했다31일 경남도는 양산시에 거주하는 50대 여성과 20대 여성이 코로나19 검사 결과 확진 판정을 받았다고 밝혔다이들은 광화문 집회에 참가한 확진자의 가족으로 확인됐다또 창원시에 거주하며 마산회원구 내서읍 약국에서 약사로 일하는 60대 여성도 이날 오후 양성 판정을 받았다현재 추가 접촉자를 파악하고 있다이로써 도내 누적 확진자 수는 237명이다김가연 기자 katekim221asiaecokr 2020년 하반기 재물운연애운건강운 체크 네이버에서 아시아경제 뉴스를 받아보세요 놀 준비 되었다면 드루와  드링킷ⓒ경제를 보는 눈 세계를 보는 창 아시아경제 무단전재 배포금지,https://news.naver.com/main/ranking/read.nhn?mid=etc&sid1=111&rankingType=popular_day&oid=277&aid=0004746549&date=20200831&type=0&rankingSectionId=102&rankingSeq=2
갭투자 말라더니…갭투자로 집 팔려다 못팔고 옷벗은 靑여현호,청와대에서 비서관급 이상 참모진은 다주택자가 한 명도 없어졌다고 청와대가 31일 밝혔다 이날 문재인 대통령이 여현호 국정홍보비서관을 윤재관 청와대 부대변인으로 교체하면서다  여현호 비서관이 한겨레 논설위원이던 2015년 법원 국민으로부터 듣다 좌담회 참석해 발언하고 있다 뉴스1여 비서관은 지난해 말부터 시작된 청와대 다주택 논란과 관련해 마지막까지 집을 팔지 못한 사람이었다  노영민 대통령 비서실장이 지난해 12월 “실거주하는 한 채를 제외한 나머지 주택은 팔라”고 했을 때 당시 청와대 다주택자는 20명에 달했다 7월 말에는 8명으로 줄었다 국민소통수석실을 통해 “8월 말이면 다주택 제로가 된다”는 선언도 했다  그러나 김조원 전 민정수석은 강남송파 아파트를 팔지 않고 청와대를 떠났다 김거성 전 시민사회수석도 교체됐다 지난 14일 청와대가 “마지막 2명이 처분 노력 중이다”라고 밝혔을 때 여 비서관과 황덕순 일자리수석충북 청주 서원 2채 흥덕 1채만 남았다 그리고 황 수석이 집을 정리한 뒤 여 비서관만 다주택자로 남은 상황이었다  마감 시한을 6일 앞둔 25일 노 실장은 국회 운영위원회에서 “이달 말에는 아마도 비서관급 이상에서 다주택자 문제가 해소될 것으로 기대한다”며 여 비서관을 압박했다 그러나 여 비서관은 결국 집을 팔지 못한 채 옷을 벗었다  청와대 관계자는 “여 비서관이 매도가를 계속 내리는 등 노력을 했지만 결국 서울 마포 아파트를 매각하지 못했다”며 “여 비서관이 결국 스스로 사의를 표명했다”고 말했다 여 비서관의 교체 배경이 결국 다주택 문제를 해결하지 못했기 때문이었다는 뜻이다  여현호 청와대 국정홍보비서관이 신고한 공직자 재산신고 내역지난 3월 공개된 공직자 재산 신고 목록에 따르면 여 비서관은 경기도 과천 아파트와 서울 마포 공덕동 아파트 등 2채를 보유하고 있다 현재 과천 아파트는 재건축 중으로 입주는 올해 말 또는 내년 초로 예상된다 이 때문에 여 비서관은 현재 거주하고 있는 마포 아파트와 관련한 재산 공개 비고 항목에 “과천 아파트 입주 시점에 매매를 추진할 예정”이라고 적었다  그러나 노 실장이 매도의 마지노선으로 제시한 8월 말은 여 비서관의 당초 계획보다 4개월 빠르다 다주택 문제를 해소하려면 집을 당장 팔아야 하지만 여 비서관이 집을 팔면 당장 머물 곳이 없어진다 과천 아파트 입주 때까지 몇 달 간 지낼 단기 월세 등을 얻어야 한다 여 비서관은 이 때문에 마포 아파트를 매물로 내놓으면서 살던 집에 그대로 전세로 머무는 조건의 전세 낀 매도’를 시도했다고 한다 이른바 갭투자 방식으로 자기 집을 사달라고 한 것이다  그런데 617 부동산 대책으로 3억 원을 넘는 아파트에 대해 기존 전세 자금 대출을 회수하는 조치가 지난달 10일부터 시행됐다 이 조치로 집값 상승의 원인이 됐던 갭투자가 크게 위축됐다 현 정부는 갭투자가 집값 상승의 주범으로 보고 있다 이때문에 갭투자로 내놨던 여 비서관의 집도 팔리지 않았다  노영민 대통령 비서실장이 25일 서울 여의도 국회에서 열린 운영위원회 전체회의에서 답변하고 있다 오종택 기자여 비서관은 마포 아파트 전용 84㎡ 집을 13억 5000만원에 내놨다고 한다 현재 부동산 포털 사이트에 등록된 동일 평수 아파트는 10여건이다 여 비서관이 내놓은 가격은 최고 호가인 14억원보다는 5000만원가량 싸다 다만 가장 낮은 13억 3000만원1층보다는 다소 높다 지금까지 해당 평수 아파트가 가장 비싸게 팔렸던 실거래가는 지난달 11일 기록했던 13억 3000만원이다  공덕동의 한 부동산 중개업체 관계자는 “전세 계약 기간이 2년 가까이 남아서 입주 시기가 너무 늦춰질 경우 통상 시장가보다 싸게 거래된다”면서도 “계약과 이사에 걸리는 시간을 감안해 보통 45개월 정도는 시장가와 비슷하게 거래되는 것이 일반적”이라고 말했다  강태화 기자 thkangjoongangcokr넌 뉴스를 찾아봐 난 뉴스가 찾아와 그래서 팩트가 뭐야 궁금하면 팩플 세상 쉬운 내 돈 관리 그게머니ⓒ중앙일보httpsjoongangcokr 무단 전재 및 재배포 금지,https://news.naver.com/main/ranking/read.nhn?mid=etc&sid1=111&rankingType=popular_day&oid=025&aid=0003030850&date=20200831&type=1&rankingSectionId=100&rankingSeq=5
동물고기 대신 식물고기를 8주간 먹자…몸이 달라졌다,스탠퍼드의대 인체 영향 첫 비교 실험콜레스테롤 수치 낮아지고 체중도 줄어식물고기 버거 패티 제품 식물고기와 동물고기의 섭취가 인체에 실제로 어떤 영향을 끼치는지에 대한 첫 비교 실험 결과가 나왔다 스탠퍼드의대 제공식물고기는 영양학적으로 동물고기의 대체품이 될 수 있을까영양학자들은 건강을 위해 고혈압 고지질 등과 관련이 있는 포화 지방과 콜레스테롤 섭취는 줄이고 지나친 나트륨 섭취도 피하라고 권한다 몸에 해로운 트랜스지방도 섭취 기피 물질이다 반면 콜레스테롤 수치와 심혈관 질환 비만 위험을 낮춰주는 섬유질은 다량 섭취해도 좋은 성분이다 그리고 가장 기본적인 건강 관리 수칙인 적정 체중 유지의 중요성을 강조한다지난해부터 미국을 중심으로 판매량이 급증하는 식물고기는 이런 면에서는 축산 동물고기보다 이점이 많다 식물에서 추출한 단백질을 주성분으로 한 식물고기 제품에는 무엇보다 콜레스테롤이나 트랜스 지방이 없다 섬유질 역시 식물고기엔 있지만 동물고기엔 없는 성분이다 그러나 제품 제조과정에서 맛을 내기 위해 코코넛 오일 소금 등의 재료를 추가하면서 식물고기에도 많은 포화 지방과 나트륨이 함유돼 있다는 점은 식물고기의 약점으로 꼽힌다이를 종합해 고려해도 식물고기는 말 그대로 대체육’이 될 수 있을까 미 스탠퍼드의대 연구진이 이런 의문을 품고 두 식품의 섭취가 인체에 끼치는 영향을 비교 실험한 연구 결과를 내놨다 두 식품의 성분 분석을 넘어 실제 인체 영향을 직접 비교 분석한 것은 이번이 처음이다동물고기는 영양가가 많은 식품이지만 건강에 해로운 포화지방과 콜레스테롤이 많은 것이 약점이다 픽사베이연구진은 우선 36명의 실험참가자를 모집했다 이어 이들을 두 그룹으로 나눠 두 가지 식단을 8주 단위로 교차 제공했다 참가자의 절반은 동물고기식물고기 순서로 나머지 절반은 그 반대 순서로 8주씩 번갈아 섭취했다 동물고기 식단은 주로 붉은 고기 제품으로 구성했고 식물고기는 비욘드미트의 제품을 사용했다 실험 참가자들은 이 기간 동안 식물고기와 동물고기를 매일 2회 이상 섭취했다 비욘드미트 식물고기 제품은 노란 완두콩의 단백질이 주재료다 여기에 비트 주스로 붉은피 색깔을 내고 코코넛 오일로 육즙을 대신했다실험 결과 식물고기는 나쁜 콜레스테롤ldl 콜레스테롤 수치와 체중에서 통계적으로 의미 있는 긍정적 효과를 나타냈다 나쁜콜레스테롤 수치는 평균 10mg 떨어졌고 체중은 평균 2파운드900g가 줄었다 이번 연구를 이끈 크리스토퍼 가드너 교수는 불과 8주만에 통계적으로 유의미한 체중 감소 효과가 나오리라고는 예상치 못했다고 밝혔다 미국의 한 식품점에 진열돼 있는 동물고기와 식물고기오른쪽 제품 GFI 웹사이트심혈관 질환 위험 물질 TMAO 수치도 감소대사 방식에 변화 준 듯연구진은 특히 실험 기간 중 참가자들의 체내 트리메틸아민옥사이드trimethylamineNoxide; TMAO 수치 변화에 주목했다 TMAO는 대식세포체내의 모든 조직에 분포하는 면역담당 세포에 콜레스테롤을 축적하고 동맥 내부에 혈전플라크를 형성해 심장질환의 위험을 높이는 물질이다 가드너 박사에 따르면 이 화합물의 체내 수치가 높은 사람들은 심장마비 같은 심혈관 질환 위험이 60 더 높다 이 물질의 전구체인 카르니틴과 콜린이 바로 붉은 고기에 있는 물질이다TMAO가 체내에서 만들어지는 과정은 2단계를 거친다 우선 콜린이나 카르니틴이 함유된 고기를 먹으면 장내세균이 이를 트리메틸아민TMA으로 바꿔준다 트리메틸아민은 생선 비린내 같은 역겨운 냄새를 발산하는 게 특징이다 트리메틸아민은 이어 간의 효소에 의해 트리메틸아민옥사이드TMAO로 변환된다실험 첫 8주 동안 붉은 고기를 먹은 참가자는 이 수치가 증가했다 반면 식물고기를 먹은 참가자는 그렇지 않았다 그런데 후반부에 식단을 바꾼 이후 특이한 현상이 나타났다 동물고기에서 식물고기로 전환한 사람들은 예상대로 이 수치가 감소했으나 식물고기에서 동물고기로 전환한 사람들에선 이 수치가 늘어나지 않았다 가드너 박사는 식물고기를 섭취한 첫 8주 동안 TMAO를 만드는 능력이 둔화됐기 때문일 것으로 추정했다 연구진은 실험 결과를 근거로 붉은 고기를 식물고기로 대체하면 일부 심혈관 질환 위험을 줄일 수 있다고 밝혔다GFI 제공이번 실험은 비욘드미트 제품을 대상으로 했지만 임파서블푸드의 식물고기 제품도 동물고기에 비해 비슷한 장점을 지니고 있다고 연구진은 밝혔다 임파서블푸드의 식물고기는 대두에서 추출한 단백질을 주재료로 뿌리혹 속 레그헤모글로빈으로 붉은피 색깔을 내고 코코넛해바라기 오일로 육즙을 대신했다 임파서블 버거의 단백질 함유량은 소고기80 살코기와 양이 같다 포화지방도 비슷한 수준이다 하지만 전체 지방은 소고기보다 적고 철분 함유량은 거의 2배에 이른다 임파서블 소지지와 임파서블 포크는 같은 열량일 경우 단백질 함유량이 5070 더 많고 철분 함유량은 전통 소시지나 돼지고기보다 3배 더 많다 특히 임파서블 푸드의 모든 제품엔 동물고기에 많은 트랜스지방이나 콜레스테롤이 전혀 없다 반면 동물고기엔 없는 복합 탄수화물과 섬유질을 많이 함유하고 있다이번 연구는 8월11일 미국임상영양학저널American Journal of Clinical Nutrition에 건강한 성인에서 트리메틸아민옥사이드와 심혈관질환 위험 요인에 미치는 동물기반 고기와 식물기반 고기의 영향에 대한 무작위 비교 교차시험  구미를 당기는 식물식품에 관한 연구고기섭취대안 시험A randomized crossover trial on the effect of plantbased compared with animalbased meat on trimethylamineNoxide and cardiovascular disease risk factors in generally healthy adults Study With Appetizing Plantfood—Meat Eating Alternative Trial SWAPMEAT이라는 긴 제목으로 발표됐다곽노필 선임기자 nopilhanicokr 곽노필의 미래창 바로가기더불어 행복한 세상을 만드는 언론 한겨레 구독하세요네이버 채널 한겨레21 구독2005년 이전 한겨레 기사 보기ⓒ한겨레신문  무단전재 및 재배포 금지,https://news.naver.com/main/ranking/read.nhn?mid=etc&sid1=111&rankingType=popular_day&oid=028&aid=0002510864&date=20200831&type=1&rankingSectionId=105&rankingSeq=1
