Title,Contents,link
"[영상] ""24년 전에 산 햄버거 썩지 않았다""…""보통 환경에서는 부패""",출처 틱톡 alysherb 24년이 지난 햄버거가 썩지 않았다는 주장이 나왔습니다현지 시간 30일 한 할머니가 옷장에 24년 동안 보관한 맥도날드 햄버거와 감자튀김을 공개했다고 미국 폭스 뉴스가 보도했습니다공개된 영상에서 할머니는 포장지에 1996년 나스카 레이스NASCAR RACE 미국 최대 자동차 경주라고 적혀 있습니다 이 안에 24년 된 햄버거가 들어 있습니다라고 말했습니다 그리고 감자튀김을 꺼내 보였습니다 그러면서 한 달 전에 산 것 같다며 전혀 썩지 않았다고 말했습니다  이어서 햄버거도 보여줬습니다출처 틱톡 alysherb빵도 그대로였고 고기는 말라 있긴 했지만 썩지 않았다고 했습니다그러면서 24년 된 햄버거를 먹으면 어떻게 될지는 모르겠다고 말했습니다  영상 속 햄버거가 어떤 제품인지는 알려지지 않았습니다  이와 비슷한 일도 있었습니다  올해 초엔 미국 유타주 한 남성이 1999년에 산 맥도날드 햄버거가 썩지 않았다고 주장했습니다  이에 대해 당시 맥도날드 안 크리스텐슨 이사는 썩으려면 특정 조건과 수분이 필요하다고 말했습니다  그러면서 건조하지 않은 곳이라면 대부분 식품과 마찬가지로 맥도날드 햄버거도 썩는다고 설명했습니다  JTBC 온라인 이슈팀출처 틱톡 alysherb 김천 기자 kimcheonjtbccokr 시청자와 함께 JTBC 뉴스 제보하기 뉴스의 뒷이야기 JTBC 취재설명서Copyright by JTBChttpjtbcjoinscom All Rights Reserved 무단 전재 및 재배포 금지,https://news.naver.com/main/ranking/read.nhn?mid=etc&sid1=111&rankingType=popular_day&oid=437&aid=0000246420&date=20200831&type=1&rankingSectionId=104&rankingSeq=2
"英 수의사 ""끓는 물 산 채로 넣은 바닷가재, 고통 느껴""",기사와 관련 없는 이미지  YTN영국에서 바닷가재를 산 채로 끓는 물에 넣지 말아야 한다는 목소리가 높아지고 있다유럽에서는 지난 수 세기 동안 살아있는 바닷가재를 끓는 물에 넣어 요리해 왔다 사람들이 바닷가재 등 갑각류는 고통을 느끼지 못한다고 생각해왔기 때문이다 그러나 최근 조개류와 갑각류도 외상을 겪고 고통을 느낄 수 있다는 증거가 발견되면서 요리사가 인간적인 요리법을 찾아야 한다는 압력이 커지고 있다영국 수의사 단체는 갑각류가 감각을 느낄 수 있다는 최근의 과학적인 증거를 고려해 바닷가재와 게를 고통으로부터 보호해야 한다고 주장했다 총 18000명의 수의사가 속한 단체는 적어도 갑각류를 요리할 때 먼저 기절시킨 다음 끓는 물에 넣는 의무 조항을 도입해야 한다고 주장했다이미 일부 영국 요리사는 갑각류를 전기 충격기로 기절하게 해 요리하는 방식을 택하고 있다 갑각류가 스트레스를 받으면 맛에 영향을 주는 불쾌한 호르몬을 방출하기 때문이다 영국 유명 쉐프 조지오 로카텔리는 이와 같은 방식은 더욱 인간적일 뿐 아니라 음식의 품질도 향상시킨다고 말했다지난 2018년 스위스는 이미 전 세계 최초로 살아있는 갑각류 요리를 금지했으며 노르웨이 뉴질랜드 오스트리아와 호주 일부 주가 그 뒤를 따랐다 영국 갑각류 보호단체 크러스트에이션 컴패션의 마이세 톰린슨은 스스로 동물 애호가라고 생각하는 사람도 게와 바닷가재는 고려하지 않는다 동물을 학살할 때 그들에게 일어나는 일은 잔인하고 용납할 수 없다고 말했다톰린슨은 이어 전기 충격으로 기절시키지 않는다면 게는 물속에서 최대 3분을 살아 있으며 가재의 경우 더 오래 걸릴 수 있다며 전기 충격기를 하루빨리 도입해야 한다고 주장했다YTN PLUS 정윤주 기자younjuyntpluscokr저작권자c YTN  YTN plus 무단전재 및 재배포 금지  이 시각 코로나19 확진자 현황을 확인하세요대한민국 대표 뉴스 채널 YTN 생방송보기네이버에서 YTN 뉴스 채널 구독하기 ,https://news.naver.com/main/ranking/read.nhn?mid=etc&sid1=111&rankingType=popular_day&oid=052&aid=0001484953&date=20200831&type=1&rankingSectionId=104&rankingSeq=3
카페에 확진자 들어오자 메뉴판이 빨갛게…공기중 코로나 잡는다,머니투데이 류준영 기자 UNIST 장재성 교수팀 전기식 바이러스 농축기종이 면역 센서’ 시스템 개발A형 독감 및 코로나 바이러스에 적용 가능 거리두기 25단계로 상향된 후 서울 강남구 한 커피숍의 모습사진이영민 기자자료사진이영민 기자 A 대형커피숍 벽면에 주문번호를 표시하는 디스플레이 화면 위로 A형 독감’ 코로나19’라는 적힌 글자가 푸른색으로 표시돼 있다 코로나19COVID19 확진자가 이곳을 방문하자 글자가 적색으로 바뀌면서 매장은 일시 폐쇄됐고 방역관과 역학조사관이 급파됐다 국내 연구진이 최근 개발한 바이러스 검출 시스템이 상용화 됐을 경우를 상상해본 모습이다 울산과학기술원UNIST 기계공학과 장재성 교수 연구팀이 코로나19나 독감 바이러스 같이 공기 중에 떠다니는 바이러스 양을 정확하고 빠르게 측정할 수 있는 기술을 개발했다고 31일 밝혔다 이는 전기장으로 공기 중 바이러스를 농축할 수 있는 장치와 농축한 바이러스의 양을 신속히 측정하는 종이센서키트로 구성됐다 장재성 교수사진UNIST이 시스템의 특징은 비말침방울뿐 아니라 1미크론㎛ 1㎛는 100만 분의 1m 미만의 에어로졸과 같은 액체 미립자 속 작은 바이러스 입자도 효과적으로 채집할 수 있고 즉각적으로 반응하는 면역 센서를 통해 채집한 바이러스를 검사하기 때문에 진단 속도가 빠르다는 점이다 적절한 방역 대책을 세우기 위해선 공기 중 바이러스 혹은 박테리아세균를 채집검사해야 한다 공기 중 바이러스를 빠르고 정확하게 진단하려면 바이러스가 포함된 채 떠다니는 비말 같은 입자를 잘 잡아내는 채집기와 채집한 바이러스를 빠르게 검출할 수 있는 센서가 필요하다공기 중 바이러스를 채집하는 기존 방식은 진공 청소기’와 유사한 방식이라 채집 가능한 입자 크기에 한계가 있고 채집 과정에서 바이러스가 손상될 우려가 크다 또 현재 바이러스 검사에 많이 쓰이는 유전자증폭방식중합효소연쇄반응검사Polymerase chain reactionPCR은 진단의 정확도는 높지만 검사 시간이 오래 걸리고 가격도 비싸다 PCR는 병원체바이러스가 지닌 유전자의 특정 영역을 단시간에 증폭시켜 병원체를 진단하는 방법을 말한다 연구팀이 전기식 바이러스 농축기와 종이 면역 센서로 만든 시스템은 10㎛ 이상의 크기부터 1㎛ 미만의 작은 입자도 효과적으로 채집할 수 있다 전기식 바이러스 농축기는 채집과정에서 정전기력을 이용하므로 손상 없이 높은 효율로 바이러스를 포집한다 장 교수는 “강한 압력 차로 공기를 빨아들일 때 큰 운동량을 얻게 된 입자들을 고체나 액체 표면에 충돌시켜 채집하는 기존  관성 충돌 방식’은 지름 1㎛ 미만의 입자부터 채집효율이 떨어지고 00301㎛의 미세한 입자는 10도 못 잡지만 이번에 개발된 정전기식 채집 방식은 1㎛ 미만의 입자도 99이상 잡아 낼 수 있다”고 설명했다 이 때문에 살아있는 바이러스를 더 많이 채집할 수 있어 검사의 신뢰성을 높일 수 있다 종이 기반 센서는 경량휴대용저가이며 적은 양의 샘플로도 채집된 샘플을 신속히 측정할 수 있다 장 교수는 “이번 실험에서 종이면역센서는 바이러스의 핵산RNA을 둘러싼 핵단백질에 대한 항체를 이용해 바이러스의 양을 측정했다”며 “임신진단키트처럼 신속하게 바이러스를 검출 하고 그 정확도는 qPCR 수준에 이른다”고 말했다 qPCRquantitativePCR은 유전자 증폭검사의 하나로 바이러스 양을 알 수 있다연구팀은 개발한 시스템을 이용해 A형 독감 바이러스를 측정하는 실험을 진행했다 그 결과 바이러스 채집 효율은 종이면역센서807가 qPCR768과 같은 상용화된 시스템보다 높고 센서의 정확도 역시 qPCR 수준으로 정확했다 공기 중 바이러스 채집 중에 같이 유입되는 미세먼지나 미생물이 측정 정확도에 미치는 영향도 분석했다 그 결과 이번 센서 시스템은 독감 바이러스만 선택적으로 잘 측정해낼 수 있음을 확인했다 센서의 최소 측정 가능 농도도 낮았다 독감 유행기에 존재하는 공기 중 미량의 바이러스도 잡아낸다는 설명이다 장 교수는 “이번 연구는 비록 신종인플루엔자 바이러스에 대해서만 이뤄졌지만 비슷한 크기와 구조 똑같이 외피를 가진 코로나19 바이러스에 대해서도 사용 가능하다”고 설명했다 이어 “현재 더 많은 공기를 뽑아들 일 수 있는 농축 장치에 관한 후속연구를 통해 시스템 고도화를 이룰 계획”이라고 덧붙였다 이번 연구성과는 환경공학 분야의 국제학술지인 환경과학기술’ 온라인판에 게재됐다류준영 기자 joon줄리아 투자노트조 변호사의 가정상담소 머니투데이 구독하기 저작권자 ⓒ 돈이 보이는 리얼타임 뉴스 머니투데이 무단전재 및 재배포 금지,https://news.naver.com/main/ranking/read.nhn?mid=etc&sid1=111&rankingType=popular_day&oid=008&aid=0004463599&date=20200831&type=1&rankingSectionId=105&rankingSeq=5
"아베 건강이상은 핑계? ""진짜 사임 이유는 아베노마스크""",아베 신조安倍晋三 일본 총리가 사의를 표명한 건 건강이 아닌 각종 스캔들과 정책 실패 때문이라는 분석이 나왔다 지병인 궤양성 대장염은 정치적 책임을 회피하기 위한 핑계에 불과하다는 것이다  아베 신조安倍晋三 일본 총리가 지난 28일 오후 총리관저에서 열린 기자회견에서 사의 의사를 밝히며 고개 숙여 인사하고 있다 연합뉴스나카노 고이치中野晃一 일본 조치上智대 교수는 30일현지시간 미국 일간 뉴욕타임스NYT에 게재한 칼럼 아베 신조는 병들었다 하지만 이게 그가 사의를 표명한 유일한 이유일까’에서 “일본 최장기 재임 총리가 책임지라’는 국민의 요구를 회피하면서 정권을 떠났다”며 이같이 주장했다나카노 교수는 아베 총리가 사의를 표명할 수밖에 없었던 가장 큰 이유로 신종 코로나바이러스 감염증코로나19 대응 실패를 꼽았다 코로나19 대응 실패로 여론이 급격히 나빠져 더 이상 총리직을 수행할 수 없는 상황에 이르렀다는 것이다 그는 “아베 총리가 팬데믹감염병의 세계적 대유행과 그 경제적 여파를 관리하려는 노력을 충분히 하지 않았고 국민 앞에서 설명도 부족했다”며 “일본인 대다수가 이에 비판적이었다”고 평가했다 그러면서 성인이 쓰기엔 크기가 작은 일명 아베노마스크’라는 천 마스크를 배포하면서 여론의 뭇매를 맞는 등 코로나19 대응 과정에서 잡음이 끊이지 않았다는 점을 지적했다  최근 수년간 제기된 스캔들도 아베 총리의 사임을 예정된 수순으로 만들었다고 나카노 교수는 주장했다 2017년 불거진 모리토모 학원 스캔들의 경우 전 모리토모학원 이사장 부부가 아베 총리 부부의 위세를 등에 업고 학교 용지로 쓸 국유지를 감정평가액보다 싸게 매입했다는 의혹이 제기됐다 이후 재무성 당국자들이 국유지 매각 관련 공문서에서 아베 총리 부부 관련 내용을 삭제 수정한 것으로 드러났지만 아베 총리는 부인만 할 뿐 설득력 있는 해명을 내놓지 못했다는 것이다아베 신조 일본 총리 연표 그래픽김현서 kimhyeonseo12joongangcokr지난해 11월엔 아베 총리가 국가 예산으로 진행되는 벚꽃을 보는 모임’ 행사에 후원회 관계자들을 초청했다는 사실이 드러났다 관련 사안에 대해 논란이 일었을 때 역시 아베 내각은 해명은커녕 행사 참석자 명부를 폐기해 더욱 거센 비판을 받았다 이밖에 아베 총리는 자신이 선호하는 검사의 정년을 연장하는 전례 없는 결정을 내린 후 이를 뒤늦게 정당화하려는 듯 검찰청법 개정을 추진한 일 측근인 국회의원 부부가 공직선거법 위반 혐의매수로 구속기소된 일 등 숱한 논란에 휘말렸다나카노 교수는 “아베 총리는 의회 언론 국민에게 설명해야 할 게 많지만 이를 가능한 한 적게 해왔다”며 “지난 6월 18일 이후 이달 28일 사의를 발표할 때까지 공식 기자회견에 참석한 적이 없는 걸 보면 어쩌면 국민의 요구를 감당 못하는 것일 수 있다”고 꼬집었다  호사카 유지保坂祐二 세종대 교수도 이와 비슷한 분석을 내놓은 바 있다 호사카 교수는 지난 29일 자신의 유튜브 채널에서 “아베 총리의 지병인 대장염은 극복이 가능한 병”이라며 “아베 총리의 스트레스 지수를 최고도로 올린 건 사실 스캔들에 대한 재판 문제”라고 주장했다  이근평 기자 leekeunpyungjoonangcokr넌 뉴스를 찾아봐 난 뉴스가 찾아와 그래서 팩트가 뭐야 궁금하면 팩플 세상 쉬운 내 돈 관리 그게머니ⓒ중앙일보httpsjoongangcokr 무단 전재 및 재배포 금지,https://news.naver.com/main/ranking/read.nhn?mid=etc&sid1=111&rankingType=popular_day&oid=025&aid=0003030872&date=20200831&type=1&rankingSectionId=104&rankingSeq=1
홍콩 부동산 30% 폭락하자 움직이는 '중국 큰손들',중국 큰손들이 지난해 시위 여파와 코로나19로 30 폭락한 홍콩 부동산 시장에 몰려들고 있다고 로이터통신이 30일현지 시간 보도했습니다부동산 거래 기록에 따르면 8월 한 달에만 중국 본토 투자자들이 최소 사무용 빌딩 두 채와 호텔 한 채를 사들였습니다이들 세 건물의 가치는 40억 홍콩달러약 6천109억 원에 달하는 것으로 나타났습니다세계적 부동산 컨설팅기업 CBRE 홍콩사무소 측은 최근 진행된 대규모 부동산 거래의 매수자는 모두 중국 투자자들이라며 특히 3분기에 중국인 매수자가 증가했다고 밝혔습니다이어 그들은 싸게 사길 원하고 있으며 장기적인 관점에서 홍콩 시장에 신뢰를 갖고 있다고 덧붙였습니다로이터는 지난 6월 30일 홍콩 국가보안법홍콩보안법이 시행되면서 중국 투자자들이 홍콩 부동산 시장으로 몰려들기 시작했다고 밝혔습니다중국 정부는 홍콩보안법이 홍콩을 안정시킬 것이라고 설명해왔습니다지난 7월에는 중국 국유기업 차이나모바일과 중국 최대 부동산 개발업체인 차이나 완커 그룹이 홍콩에서 각각 56억 홍콩달러약 8천559억 원 37억 홍콩달러약 5천655억 원 규모의 토지를 구매했습니다홍콩 부동산중개업체 리카코프 측은 더 많은 중국 투자자들이 홍콩 부동산을 사기 위해 몰려올 것으로 기대한다고 말했습니다리카코프는 홍콩보안법 시행으로 향후 홍콩이 더욱 안정되면 더 많은 중국 기업들이 홍콩에 지사를 열 것이며 이는 사무용 부동산 시장 회복을 도울 것이라고 설명했습니다로이터는 이는 외국 투자자들이 홍콩 시장에서 발을 빼려는 움직임과 대조를 이룬다고 밝혔습니다부동산기업 미들랜드 ICI의 대니얼 웡 CEO는 외국인 투자자들은 여전히 움직이지 않고 있다 그들은 현재 홍콩의 정치적 위험이 큰 탓에 홍콩 시장은 고려하지 않고 있다고 말한다고 전했습니다로이터는 중국 당국이 국유기업들에 투자 확대 등 홍콩에서 더욱 적극적으로 활동할 것을 주문하고 있다고 밝혔습니다사진연합뉴스 권태훈 기자rhorsesbscokr SBS 뉴스 네이버에서 편하게 받아보세요​ 뉴스속보 보기 코로나19 재확산 비상 더 깊은 인물 이야기 그 사람 ⓒ SBS  SBS Digital News Lab  무단복제 및 재배포 금지,https://news.naver.com/main/ranking/read.nhn?mid=etc&sid1=111&rankingType=popular_day&oid=055&aid=0000838361&date=20200831&type=1&rankingSectionId=104&rankingSeq=4
포천서 SUV가 미군 장갑차 추돌···SUV 탑승한 부부 2쌍 모두 사망,주한미군국방부 “포천 사고 희생자 애도 훈련 중단”30일 오후 9시 30분께 경기도 포천시 관인면 중리 영로대교에서 스포츠유틸리티 차량이 미군 장갑차를 추돌하는 사고가 발생해 군과 경찰소방 관계자들이 사고 현장을 수습하고 있다사진제공경기북부소방재난본부서울경제 경기도 포천에서 스포츠유틸리티차량SUV이 미군 장갑차를 추돌하는 사고가 발생해 SUV 탑승자 4명 전원이 사망했다31일 군당국과 경찰에 따르면 지난 30일 오후 9시 30분께 포천시 미8군 로드리게스 사격장영평사격장 인근 영로대교에서 SUV가 미군 장갑차를 추돌했다이 사고로 SUV에 타고 있던 50대 4명여성 2명 남성 2명이 크게 다쳐 병원으로 옮겨져 심폐소생술을 받았으나 끝내 숨졌다 또 장갑차에 타고 있던 미군 1명이 가벼운 부상을 입어 병원으로 이송됐다사고 당시 충격으로 SUV 차량의 엔진 부분은 형체를 알 수 없을 정도로 파손됐으며 장갑차 역시 오른쪽 무한궤도가 이탈했다 SUV 탑승자들은 포천에 거주하는 부부 2쌍으로 함께 모임을 마치고 귀가하던 것으로 전해졌다이 도로는 로드리게스 사격장과 인접한 길로 야간에도 주한미군 궤도차량이 이동하는 곳이다 당시 미군 장갑차들은 훈련을 마치고 줄지어 철원에 있는 부대로 복귀하던 중이었다30일 오후 9시 30분께 경기도 포천시 관인면 중리 영로대교에서 스포츠유틸리티 차량이 미군 장갑차를 추돌하는 사고가 발생해 군과 경찰소방 관계자들이 사고 현장을 수습하고 있다사진제공경기북부소방재난본부주한미군과 해리 해리스 주한 미국 대사는 이번 사고와 관련해 애도를 표했다주한미군 사령부는 “비극적 사고로 사망한 민간인 가족에게 조의를 표하고 미군은 한국 정부의 조사에 협조할 것”며 “미군은 희생자를 애도하면서 일시적으로 해당 지역의 훈련을 중단한다”고 밝혔다해리스 대사도 자신의 트위터에 “포천에서 일어난 비극적인 교통사고로 사망한 희생자들 그리고 유족들께 주한미군과 더불어 진심 어린 애도를 표한다”고 전했다국방부도 이번 사고에 대해 애도를 표하고 조문하기로 했다 국방부는 “사고 조사와 결과에 따른 후속 조치가 이뤄질 수 있도록 주한미군 및 관련기관에 협조할 것”이라며 “9월 1일 정경두 국방부 장관의 조화를 전달하고 국방부 차원의 조문을 할 예정”이라고 밝혔다김정욱기자 mykjsedailycom서울경제 바로가기 산업이슈 알기쉽게 양철민의 인더스트리 네이버 채널에서 서울경제 구독해주세요저작권자 ⓒ 서울경제 무단 전재 및 재배포 금지,https://news.naver.com/main/ranking/read.nhn?mid=etc&sid1=111&rankingType=popular_day&oid=011&aid=0003790699&date=20200831&type=1&rankingSectionId=100&rankingSeq=2
"""저 어떡해요""···PC방 폐업 통보하자 직원도 울었다",퇴직금으로 8년째 운영하다 코로나19매출 3분의 1“혼자도 가게지켰는데”폐업통보에 직원도 울고마통만 두개“자녀 입학하면 대출 받으라고 해야”A씨가 운영했던 PC방에 설치됐던 PC가 치워지고 쓰레기 봉투 등이 쌓여있다폐업을 경절하기 전 A씨가 운영하던 PC방 내부서울경제 “올해 아이가 수능인데 막막합니다 다 처분하고 마이너스 통장만 두 개 남았습니다 폐업 이야기를 꺼내자 직원도 울더라구요”경기 안산에서 8년째 PC방을 운영해 온 A씨51는 31일 본지와 전화통화에서 “폐업신고를 했다”며 한숨을 쉬었다 이 PC방은 주변에 영화관이 있을 만큼 번화가에 위치했다 한 때 200대를 운영하던 PC방은 최저임금 인상 등으로 인해 몇 년 전 100대로 줄였지만 올해 신종 코로나 바이러스 감염증코로나19 사태가 터지기 전까지 버틸만했다 A씨는 “직접 나와 일하면서 아르바이트생은 1명씩 3교대로 운영하면서 버텨왔다”며 “올해 2월부터 가게 상황이 너무 안 좋아졌다”고 말했다 A씨 PC방은 코로나19가 터지기 전 월 매출은 3000만원 초반대를 유지했다 하지만 700만원대 인건비3명과 PC 렌털비 전기세 등을 빼고 나면 수익 규모는 크지 않았다고 한다 그러다가 올해 2월이 되면서 매출은 2000만원대로 줄더니 폐업을 결정한 지난달에는 1000만원대로 떨어져 더 이상 운영을 유지하기 힘들어졌다 지난 19일 정부가 전격적으로 PC방을 고위험군 시설로 분류하면서 영업제한을 조치한 게 결정적이었다 A씨는 “PC방은 환기시설 기준이 까다로워 영업허가를 받기 쉽지 않다”며 “국내에 없는 초밀입자 분사기 두 대까지 140만원 들여 구입해 방역에는 문제없다고 생각했는데 갑자기 영업제한이 이뤄졌다”고 답답해했다 A씨뿐만 아니라 PC방 단체들은 갑작스러운 영업제한 조치로 인해 타격이 크다며 정부에 법적 대응까지 검토하고 있다 A씨는 “영업제한 조치를 예고했더라면 건물주를 만나 임대료 부분을 설득하고 렌털업체와도 렌털비를 일시적으로 늦춰받을 수 있는지 물어봤을 것”이라며 “건물주가 그나마 폐업 이후 남아있는 몇 개월 월세는 받지 않겠다고 해 다행”이라고 말했다A씨가 폐업 결정을 들은 직원 B씨는 울음을 터트렸다고 한다 A씨가 PC방을 열 때부터 가게를 지킨 가족같은 직원이다 A씨는 “수술을 앞두고 있어 2주간 휴가를 다녀왔다가 폐업하게 됐다는 이야기를 듣자마자 울먹였다”며 “지금 같은 시기에 어떻게 일을 구하느냐는 말이 지금도 마음에 남아있다”고 말했다 기업에 다니다가 퇴직금으로 차린 PC방을 정리하면서 A씨는 마이너스 통장 두 개가 남았다 영업제한 기간에도 혹시나 PC방에 도둑이 들까봐 혼자 불을 켜고 지키던 가게였다 1억5000만원 들여 PC방에 배치한 100개 PC는 3분의 1도 안되는 가격에 처분했다 평소라면 3분의 2를 받을 수 있었지만 지금은 PC를 사려는 수요도 없다 정부 지원금은 벌써 소진됐다’ 대기가 길다’는 주변의 걱정 탓에 포기한 지 오래다 A씨는 “최근 가게 맞은 편에 PC방을 차린 한 사장이 찾아와 앞으로 막막하다’고 걱정을 털어놨다”며 “코로나19가 끝나기 전까지 모든 사장들의 생계가 걱정”이라고 말했다 A씨는 올해 수능을 앞둔 자녀 한 명을 뒀다 그는 “다시 가게는 못 차릴 것 같다”며 “대학 입학하면 대출받아야될 것 같다고 이야기해야하는데 입이 떨어지지 않는다”고 전했다 양종곤기자 ggm11sedailycom서울경제 바로가기 산업이슈 알기쉽게 양철민의 인더스트리 네이버 채널에서 서울경제 구독해주세요저작권자 ⓒ 서울경제 무단 전재 및 재배포 금지,https://news.naver.com/main/ranking/read.nhn?mid=etc&sid1=111&rankingType=popular_day&oid=011&aid=0003790597&date=20200831&type=1&rankingSectionId=101&rankingSeq=4
